record_id,title,controlling_body,why_unavailable_or_restricted,access_procedure,estimated_availability,alternative_sources
REST-0001,Official 1949 inquest file direct copy from State Records SA,State Records of South Australia,"Open record identified, but direct official archive copy was not acquired in this mission; Abbott-hosted reproduction was acquired instead.",Request/copy GRG 1/27 File 71/1949 from State Records SA.,"Open, subject to archive copy services and fees.",DOC-0001 Abbott-hosted reproduction; SRC-0003 archive guide.
REST-0002,Official 1958 later inquest file direct access,Coroner's Court of South Australia / State Records SA,State Records SA states access to GRG 1/27 File 53/1958 is restricted and must be requested through the Coroner's Court.,Apply to Coroner's Court citing GRG 1/27 File 53/1958.,Unknown; depends on approval.,DOC-0002 Abbott-hosted reproduction.
REST-0003,Current SAPOL open investigation file and original police property/evidence registers,South Australia Police,State Records SA states police files were not transferred because the case remains an open investigation.,Formal SAPOL media/records request or freedom-of-information pathway where available; expect restrictions.,Unknown; likely restricted while investigation remains open.,DOC-0004; DOC-0005; DOC-0006; DOC-0001.
REST-0004,Forensic Science SA post-2021 exhumation and DNA/toxicology reports,Forensic Science SA / SAPOL / Coroner as applicable,No public full report acquired; may contain sensitive forensic and personal data.,Request public release/status from SAPOL/FSSA; check coroner updates.,Unknown.,Public statements/news reports catalogued in Mission 2.
REST-0005,Sands and McDougall 1947/1948/1950 full directory scans,Abbott archive / original directory rights holder unknown,Public files located but not locally preserved due 1.28 GB size per file and lower relevance to core primary-source review.,Download selectively from Abbott archive or consult library directory copies.,Available online at source at time of mission.,DOC-0019 Jetty Road 1948 extract.
REST-0006,Wells copy of Omar Khayyam full scan,Abbott archive / original rights holder unknown,Public file located but not locally preserved due 1.28 GB size and uncertain immediate need.,Download selectively from Abbott archive if Rubaiyat edition comparison becomes active.,Available online at source at time of mission.,DOC-0015 code image; DOC-0001 inquest file.
