hypothesis_id,description,supporting_evidence,contradictory_evidence,current_confidence,notes
HYP-001,"Suicide","","","Not Yet Assessed","Created for future evaluation only."
HYP-002,"Poisoning by known or rare toxin","","","Not Yet Assessed","Created for future evaluation only."
HYP-003,"Homicide by poisoning or other covert means","","","Not Yet Assessed","Created for future evaluation only."
HYP-004,"Espionage-related death","","","Not Yet Assessed","Created for future evaluation only."
HYP-005,"Personal dispute or relationship-related death","","","Not Yet Assessed","Created for future evaluation only."
HYP-006,"Accidental death or natural death misinterpreted as suspicious","","","Not Yet Assessed","Created for future evaluation only."
HYP-007,"Misadventure involving self-administered substance without suicidal intent","","","Not Yet Assessed","Created for future evaluation only."
